statement ok
CREATE TABLE t(id int PRIMARY KEY, b boolean);

statement ok
INSERT INTO t(id, b) VALUES (1, false);

statement error expected predicate type of WHERE to be of type bool, got type int
UPDATE t SET b = true WHERE 99;

statement ok
UPDATE t SET b = true WHERE b;

query I
SELECT * FROM t;
----
1 false

statement ok
UPDATE t SET b = true;

query I
SELECT * FROM t;
----
1 true

